{
  "$id": "https://raw.githubusercontent.com/ichakradharg/skyfig/main/Schema/skyfig.tokens.schema.json",
  "$schema": "https://json-schema.org/draft/2020-12/schema",
  "additionalProperties": false,
  "properties": {
    "$schema": {
      "type": "string"
    },
    "defaultTheme": {
      "const": "light"
    },
    "name": {
      "minLength": 1,
      "pattern": "\\S",
      "type": "string"
    },
    "schemaVersion": {
      "const": "1.0.0"
    },
    "themes": {
      "prefixItems": [
        {
          "const": "light"
        },
        {
          "const": "dark"
        }
      ],
      "items": false,
      "maxItems": 2,
      "minItems": 2,
      "type": "array"
    },
    "tokens": {
      "$ref": "#/$defs/tokenCollection"
    }
  },
  "required": [
    "$schema",
    "schemaVersion",
    "name",
    "defaultTheme",
    "themes",
    "tokens"
  ],
  "title": "Skyfig canonical design tokens",
  "type": "object",
  "$defs": {
    "color": {
      "pattern": "^#[0-9A-F]{8}$",
      "type": "string"
    },
    "colorToken": {
      "additionalProperties": false,
      "properties": {
        "description": {
          "type": "string"
        },
        "values": {
          "additionalProperties": false,
          "properties": {
            "dark": {
              "$ref": "#/$defs/color"
            },
            "light": {
              "$ref": "#/$defs/color"
            }
          },
          "required": [
            "light",
            "dark"
          ],
          "type": "object"
        }
      },
      "required": [
        "values"
      ],
      "type": "object"
    },
    "dimensionToken": {
      "additionalProperties": false,
      "properties": {
        "description": {
          "type": "string"
        },
        "value": {
          "minimum": 0,
          "type": "number"
        }
      },
      "required": [
        "value"
      ],
      "type": "object"
    },
    "opacityToken": {
      "additionalProperties": false,
      "properties": {
        "description": { "type": "string" },
        "value": { "minimum": 0, "maximum": 1, "type": "number" }
      },
      "required": ["value"],
      "type": "object"
    },
    "materialToken": {
      "additionalProperties": false,
      "properties": {
        "description": { "type": "string" },
        "value": { "enum": ["ultraThin", "thin", "regular", "thick"] }
      },
      "required": ["value"],
      "type": "object"
    },
    "symbolToken": {
      "additionalProperties": false,
      "properties": {
        "availability": { "type": "string" },
        "description": { "type": "string" },
        "name": { "minLength": 1, "type": "string" },
        "renderingMode": { "enum": ["monochrome", "hierarchical", "palette", "multicolor"] },
        "scale": { "enum": ["small", "medium", "large"] },
        "tint": { "minLength": 1, "type": "string" },
        "weight": { "enum": [100, 200, 300, 400, 500, 600, 700, 800, 900] }
      },
      "required": ["name", "weight", "scale", "renderingMode", "tint"],
      "type": "object"
    },
    "motionToken": {
      "additionalProperties": false,
      "properties": {
        "curve": { "enum": ["easeInOut", "easeIn", "easeOut", "linear"] },
        "description": { "type": "string" },
        "duration": { "minimum": 0, "type": "number" },
        "reduceMotionDuration": { "minimum": 0, "type": "number" }
      },
      "required": ["duration", "curve", "reduceMotionDuration"],
      "type": "object"
    },
    "shadowLayer": {
      "additionalProperties": false,
      "properties": {
        "blur": {
          "minimum": 0,
          "type": "number"
        },
        "color": {
          "additionalProperties": false,
          "properties": {
            "dark": {
              "$ref": "#/$defs/color"
            },
            "light": {
              "$ref": "#/$defs/color"
            }
          },
          "required": [
            "light",
            "dark"
          ],
          "type": "object"
        },
        "kind": {
          "enum": [
            "drop",
            "inner"
          ]
        },
        "spread": {
          "type": "number"
        },
        "x": {
          "type": "number"
        },
        "y": {
          "type": "number"
        }
      },
      "required": [
        "kind",
        "color",
        "x",
        "y",
        "blur",
        "spread"
      ],
      "type": "object"
    },
    "shadowToken": {
      "additionalProperties": false,
      "properties": {
        "description": {
          "type": "string"
        },
        "value": {
          "items": {
            "$ref": "#/$defs/shadowLayer"
          },
          "minItems": 1,
          "type": "array"
        }
      },
      "required": [
        "value"
      ],
      "type": "object"
    },
    "tokenCollection": {
      "additionalProperties": false,
      "properties": {
        "borderWidths": {
          "$ref": "#/$defs/tokenMap",
          "additionalProperties": {
            "$ref": "#/$defs/dimensionToken"
          },
          "type": "object"
        },
        "colors": {
          "$ref": "#/$defs/tokenMap",
          "additionalProperties": {
            "$ref": "#/$defs/colorToken"
          },
          "type": "object"
        },
        "cornerRadii": {
          "$ref": "#/$defs/tokenMap",
          "additionalProperties": {
            "$ref": "#/$defs/dimensionToken"
          },
          "type": "object"
        },
        "dynamic": {
          "$ref": "#/$defs/dynamicTokenCollection"
        },
        "materials": {
          "$ref": "#/$defs/tokenMap",
          "additionalProperties": { "$ref": "#/$defs/materialToken" },
          "type": "object"
        },
        "metrics": {
          "$ref": "#/$defs/tokenMap",
          "additionalProperties": { "$ref": "#/$defs/dimensionToken" },
          "type": "object"
        },
        "motion": {
          "$ref": "#/$defs/tokenMap",
          "additionalProperties": { "$ref": "#/$defs/motionToken" },
          "type": "object"
        },
        "opacities": {
          "$ref": "#/$defs/tokenMap",
          "additionalProperties": { "$ref": "#/$defs/opacityToken" },
          "type": "object"
        },
        "shadows": {
          "$ref": "#/$defs/tokenMap",
          "additionalProperties": {
            "$ref": "#/$defs/shadowToken"
          },
          "type": "object"
        },
        "spacing": {
          "$ref": "#/$defs/tokenMap",
          "additionalProperties": {
            "$ref": "#/$defs/dimensionToken"
          },
          "type": "object"
        },
        "symbols": {
          "$ref": "#/$defs/tokenMap",
          "additionalProperties": { "$ref": "#/$defs/symbolToken" },
          "type": "object"
        },
        "typography": {
          "$ref": "#/$defs/tokenMap",
          "additionalProperties": {
            "$ref": "#/$defs/typographyToken"
          },
          "type": "object"
        }
      },
      "type": "object"
    },
    "tokenMap": {
      "propertyNames": {
        "pattern": "^[a-z_][A-Za-z0-9_]*(\\.[a-z_][A-Za-z0-9_]*)*$"
      },
      "type": "object"
    },
    "dynamicTokenCollection": {
      "additionalProperties": false,
      "properties": {
        "colors": { "$ref": "#/$defs/tokenMap", "additionalProperties": { "$ref": "#/$defs/colorToken" }, "type": "object" },
        "numbers": { "$ref": "#/$defs/tokenMap", "additionalProperties": { "$ref": "#/$defs/themedNumberToken" }, "type": "object" },
        "strings": { "$ref": "#/$defs/tokenMap", "additionalProperties": { "$ref": "#/$defs/themedStringToken" }, "type": "object" },
        "booleans": { "$ref": "#/$defs/tokenMap", "additionalProperties": { "$ref": "#/$defs/themedBooleanToken" }, "type": "object" }
      },
      "type": "object"
    },
    "themedNumberToken": { "$ref": "#/$defs/themedValueToken", "properties": { "values": { "$ref": "#/$defs/themedNumberValues" } } },
    "themedStringToken": { "$ref": "#/$defs/themedValueToken", "properties": { "values": { "$ref": "#/$defs/themedStringValues" } } },
    "themedBooleanToken": { "$ref": "#/$defs/themedValueToken", "properties": { "values": { "$ref": "#/$defs/themedBooleanValues" } } },
    "themedValueToken": {
      "additionalProperties": false,
      "properties": { "description": { "type": "string" }, "values": { "type": "object" } },
      "required": ["values"], "type": "object"
    },
    "themedNumberValues": { "additionalProperties": false, "properties": { "light": { "type": "number" }, "dark": { "type": "number" } }, "required": ["light", "dark"], "type": "object" },
    "themedStringValues": { "additionalProperties": false, "properties": { "light": { "type": "string" }, "dark": { "type": "string" } }, "required": ["light", "dark"], "type": "object" },
    "themedBooleanValues": { "additionalProperties": false, "properties": { "light": { "type": "boolean" }, "dark": { "type": "boolean" } }, "required": ["light", "dark"], "type": "object" },
    "typographyToken": {
      "additionalProperties": false,
      "properties": {
        "description": {
          "type": "string"
        },
        "value": {
          "additionalProperties": false,
          "properties": {
            "fontFamily": {
              "minLength": 1,
              "pattern": "\\S",
              "type": "string"
            },
            "fontSize": {
              "exclusiveMinimum": 0,
              "type": "number"
            },
            "fontWeight": {
              "enum": [
                100,
                200,
                300,
                400,
                500,
                600,
                700,
                800,
                900
              ]
            },
            "letterSpacing": {
              "type": "number"
            },
            "lineHeight": {
              "exclusiveMinimum": 0,
              "type": "number"
            }
          },
          "required": [
            "fontFamily",
            "fontSize",
            "fontWeight",
            "lineHeight",
            "letterSpacing"
          ],
          "type": "object"
        }
      },
      "required": [
        "value"
      ],
      "type": "object"
    }
  }
}
