{
  "$schema": "../../../Schema/skyfig.tokens.schema.json",
  "schemaVersion": "1.0.0",
  "name": "Shared colors",
  "defaultTheme": "light",
  "themes": ["light", "dark"],
  "tokens": {
    "colors": {
      "shared.accent": {
        "values": {
          "light": "#0369A1FF",
          "dark": "#38BDF8FF"
        }
      }
    }
  }
}
